<?xml version="1.0"?>
<config xmlns:xsi="http://www.w3.org/2001/XMLSchema-instance" xsi:noNamespaceSchemaLocation="urn:magento:module:Vnecoms_PageBulder:etc/vcms_section.xsd">
	<types>

		<type name="layout" sortOrder="1">
			<label>Layout</label>
			<resource>page_builder</resource>
		</type>

		<type name="welcome" sortOrder="10">
			<label>Welcome</label>
			<resource>page_builder</resource>
		</type>
		<type name="about" sortOrder="20">
			<label>About</label>
			<resource>page_builder</resource>
		</type>
        <type name="features" sortOrder="30">
            <label><![CDATA[Features & Services]]></label>
            <resource>page_builder</resource>
        </type>
        <type name="faq" sortOrder="30">
            <label>FAQ</label>
            <resource>page_builder</resource>
        </type>
        
        <type name="team" sortOrder="40">
            <label>Our Team</label>
            <resource>page_builder</resource>
        </type>
        
        <type name="testimonial" sortOrder="40">
            <label>Testimonials</label>
            <resource>page_builder</resource>
        </type>

		<type name="other" sortOrder="1000">
			<label>Others</label>
			<resource>page_builder</resource>
		</type>
	</types>
    <sections>
    	<include path="Vnecoms_PageBuilder::vcms_section/default.xml" />
    	<include path="Vnecoms_PageBuilder::vcms_section/feature8.xml" />
    	<include path="Vnecoms_PageBuilder::vcms_section/feature9.xml" />
        <include path="Vnecoms_PageBuilder::vcms_section/feature1.xml" />
        <include path="Vnecoms_PageBuilder::vcms_section/feature2.xml" />
        <include path="Vnecoms_PageBuilder::vcms_section/feature3.xml" />
        <include path="Vnecoms_PageBuilder::vcms_section/feature4.xml" />
        <include path="Vnecoms_PageBuilder::vcms_section/feature5.xml" />
        <include path="Vnecoms_PageBuilder::vcms_section/feature6.xml" />
        <include path="Vnecoms_PageBuilder::vcms_section/feature7.xml" />
        <include path="Vnecoms_PageBuilder::vcms_section/faq1.xml" />
        <include path="Vnecoms_PageBuilder::vcms_section/faq2.xml" />
        <include path="Vnecoms_PageBuilder::vcms_section/other-1col.xml" />
        <include path="Vnecoms_PageBuilder::vcms_section/other-2cols.xml" />
        <include path="Vnecoms_PageBuilder::vcms_section/other-3cols.xml" />
        <include path="Vnecoms_PageBuilder::vcms_section/other-4cols.xml" />
        <include path="Vnecoms_PageBuilder::vcms_section/welcome1.xml" />
        
        <include path="Vnecoms_PageBuilder::vcms_section/team1.xml" />
        <include path="Vnecoms_PageBuilder::vcms_section/team2.xml" />
        
        <include path="Vnecoms_PageBuilder::vcms_section/testimonial1.xml" />
        
        
        <include path="Vnecoms_PageBuilder::vcms_section/layout-2column-left.xml" />
	</sections>
</config>
